{"version":"1.0","message_id":"result-1","type":"task.result","node_id":"node-demo","correlation_id":"task-inspect-1","sent_at":"2026-10-29T08:00:01Z","payload":{"task_id":"task-inspect-1","attempt":1,"resource_id":"node-demo","state":"succeeded","inspection":{"os":"linux","arch":"amd64","hostname":"test-node"}}}
